{
  "schemaVersion": 1,
  "id": "omdsh-dev.dsh-better-sidebar",
  "name": "Better Sidebar",
  "description": "DSH 右侧栏与底部面板工作台，提供文件浏览与编辑、终端、Git、浏览器、后台任务，以及供其他插件注册侧栏页面和文件预览器的服务。安装包自动镜像自 npm，属于社区镜像，并非上游签名发布。",
  "publisher": "omdsh-dev",
  "packageName": "dsh-better-sidebar",
  "repository": {
    "id": 1326893710,
    "url": "https://github.com/omdsh-dev/DSH-better-sidebar"
  },
  "updates": {
    "source": "npm",
    "distTag": "latest"
  },
  "release": {
    "version": "0.15.2",
    "assetUrl": "https://github.com/run-bigpig/dsh-plugin-hub/releases/download/mirror-omdsh-dev-dsh-better-sidebar-v0.15.2/dsh-better-sidebar-0.15.2.tgz",
    "sha256": "d932367e9b436e3f515394f55e90c5793253a51d357b9d390ab16cb9e91931a9"
  },
  "compatibility": {
    "harnessCommits": [
      "47f943859bef60e4160492346772ded9b24f765a"
    ]
  },
  "permissions": [
    "network",
    "filesystem-read",
    "filesystem-write",
    "subprocess"
  ],
  "license": "MIT",
  "verified": false
}
